name,url,category,subcategory,description,keywords,pricing,analysis
Shadcn/ui,https://ui.shadcn.com,design-system,open-source-ds,基于 Radix + Tailwind 的可复制粘贴组件集,react tailwind radix copy paste components shadcn,free,"核心特色：基于 Radix UI + Tailwind CSS 的可复制粘贴组件集合（非传统 npm 包）。适用场景：React + Tailwind 项目快速搭建美观且可完全控制的 UI。优势：代码完全在你的项目中（可任意修改），设计精美，社区生态爆发式增长。局限：仅适用于 React + Tailwind 技术栈。推荐理由：2024-2025 年最火的前端 UI 方案，拥有即修改的理念颠覆了传统组件库模式。"
Headless UI,https://headlessui.com,design-system,open-source-ds,Tailwind Labs 无样式可访问 UI 组件,headless unstyled accessible tailwind react vue,free,"核心特色：Tailwind Labs 官方出品的无样式 UI 组件库，支持 React 和 Vue。适用场景：Tailwind CSS 项目中需要复杂交互组件（下拉/对话框/Tab 等）。优势：与 Tailwind 完美配合，React + Vue 双版本，无障碍支持好。局限：组件数量有限（仅覆盖复杂交互组件），需要自行用 Tailwind 写样式。推荐理由：Tailwind 项目的最佳拍档，解决了 Tailwind 处理复杂交互组件的痛点。"
daisyUI,https://daisyui.com,design-system,open-source-ds,Tailwind CSS 组件库，提供丰富预设主题,tailwind css component library themes daisy,free,"核心特色：基于 Tailwind CSS 的组件类名库，提供 30+ 预设主题。适用场景：快速搭建有设计感的页面、需要多主题切换的项目。优势：纯 CSS 类名（无 JS），主题切换一行代码，减少 Tailwind 类名堆叠。局限：组件行为需要自行实现（纯样式层），定制粒度不如原生 Tailwind。推荐理由：让 Tailwind 项目瞬间拥有设计感的捷径，主题系统是最大亮点。"
Element Plus,https://element-plus.org,component,component-lib,Vue 3 企业级 UI 组件库,vue3 component library enterprise element plus,free,"核心特色：Vue 3 版本的 Element UI，国内最流行的 Vue 组件库。适用场景：Vue 3 中后台管理系统、企业级 B 端产品。优势：组件齐全（70+），中文文档完善，国内社区庞大，按需导入支持好。局限：设计风格较为保守，移动端适配有限。推荐理由：Vue 3 中后台项目的首选组件库，国内生态最成熟。"
Naive UI,https://www.naiveui.com,component,component-lib,Vue 3 TypeScript 友好的组件库,vue3 typescript component library naive ui,free,"核心特色：全量 TypeScript 编写的 Vue 3 组件库，类型安全极佳。适用场景：TypeScript 严格模式的 Vue 3 项目、追求 DX 的开发团队。优势：TypeScript 类型推导完美，主题定制灵活（CSS-in-JS），组件丰富（80+），API 设计一致。局限：国际化生态不如 Element Plus，社区规模较小。推荐理由：Vue 3 + TypeScript 项目的最佳搭档，类型体验碾压同类库。"
Vuetify,https://vuetifyjs.com,component,component-lib,Vue Material Design 组件框架,vue material design component framework vuetify,free,"核心特色：Vue 生态中最完整的 Material Design 组件框架。适用场景：需要 Material Design 风格的 Vue 项目、快速搭建标准化 UI。优势：遵循 Material Design 规范，组件极其丰富，内置响应式网格系统。局限：强 Material Design 风格难以定制为其他风格，包体积大。推荐理由：Vue 生态中功能最全面的组件库，适合追求标准化和快速开发。"
Arco Design,https://arco.design,component,component-lib,字节跳动企业级设计系统与组件库,bytedance design system component library vue react,free,"核心特色：字节跳动出品的企业级设计系统，同时支持 React 和 Vue。适用场景：追求现代化设计风格的企业级项目、React/Vue 双栈团队。优势：设计风格现代清新，React + Vue 双版本，图标库丰富，主题定制方便。局限：社区生态不如 Ant Design/Element Plus 成熟。推荐理由：颜值与功能兼备的新生代组件库，双框架支持是独特优势。"
Mantine,https://mantine.dev,component,component-lib,React 全功能组件库，含丰富 hooks,react component library hooks mantine full featured,free,"核心特色：React 全功能 UI 库，组件+hooks+表单+通知+富文本一站式解决。适用场景：React 全栈项目、需要丰富内置功能（日期选择/富文本/通知系统等）的项目。优势：功能覆盖极广（100+组件/50+hooks），文档清晰，暗色模式内置，样式方案灵活。局限：与 Tailwind 集成不如 shadcn/ui 原生。推荐理由：React 生态中功能最全面的一站式 UI 解决方案，减少三方依赖。"
Collectui,https://collectui.com,aggregate,curated,每日 UI 设计灵感精选，按组件类型分类,daily ui inspiration curated component category,free,"核心特色：基于 Daily UI 挑战的设计灵感集合，按组件类型分类。适用场景：按 UI 组件类型（登录/卡片/导航等）寻找设计灵感。优势：完全免费，按组件类型分类浏览极其方便，内容量大。局限：作品来自社区挑战，质量参差不齐。推荐理由：按组件类型找灵感的最直接方式，适合快速参考特定组件的设计方案。"
UI Garage,https://uigarage.net,aggregate,curated,按设计模式和组件分类的 UI 灵感库,ui patterns components categorized inspiration garage,free,"核心特色：按设计模式和 UI 组件类型分类的综合灵感库。适用场景：按交互模式/组件类型/平台浏览多样化的 UI 设计方案。优势：完全免费，覆盖 Web/iOS/Android 三平台，分类维度丰富。局限：界面设计略显过时，加载速度一般。推荐理由：跨平台 UI 灵感集合，一个站点覆盖多端设计参考需求。"
